{
  "$schema": "../SPECS/config.schema.json",
  "version": "0.1",
  "name": "phase1-overflow",
  "description": "Minimal overflow scenario: one compute node has a deliberately small local tier, so even a single KV cache exceeds local capacity and must use the shared pool. This verifies the remote path, eviction, and traffic accounting. It is not a hardware recommendation and must not be used for absolute performance claims.",
  "assumptions": [
    "Local capacity is intentionally set to 2 GiB to force overflow. A real H100 node has far more DRAM; this scenario exists only to exercise the remote path.",
    "One compute node and one shared pool keep the event stream small enough to inspect by hand.",
    "The workload is synthetic KV-cache decode derived from Llama-3-70B geometry, not a captured trace.",
    "The compute tokens_per_second field is omitted, matching examples/llama-70b-cxl.json. Request duration is therefore driven by modeled memory accesses, not accelerator throughput."
  ],
  "seed": 7,
  "duration_ns": 10000000000,
  "warmup_ns": 1000000000,
  "page_size_bytes": 2097152,
  "nodes": [
    {
      "id": "node-0",
      "role": "compute",
      "local_memory": {
        "capacity_bytes": 2147483648,
        "latency_ns": 90,
        "bandwidth_bytes_per_ns": 400,
        "provenance": {
          "kind": "assumed",
          "source": "docs/HARDWARE-MODELS.md local DRAM preset, capacity overridden for this test",
          "method": "Latency and bandwidth use the local DRAM preset. Capacity is deliberately reduced to 2 GiB so one 8k-context Llama-3-70B KV cache (about 2.54 GiB) cannot fit.",
          "date": "2026-10-29",
          "notes": "Test fixture, not a deployment configuration."
        }
      },
      "compute": {
        "accelerator": "H100-80GB",
        "accelerators": 8,
        "accelerator_memory_bytes": 85899345920,
        "provenance": {
          "kind": "sourced",
          "source": "NVIDIA H100 SXM product brief",
          "method": "Accelerator count and memory capacity from the product class. tokens_per_second intentionally omitted.",
          "date": "2026-10-29"
        }
      }
    },
    {
      "id": "remote-pool",
      "role": "memory",
      "remote_memory": {
        "capacity_bytes": 1099511627776,
        "latency_ns": 180,
        "bandwidth_bytes_per_ns": 48,
        "provenance": {
          "kind": "assumed",
          "source": "docs/HARDWARE-MODELS.md CXL 2.0/3.0 preset",
          "method": "CXL.mem class latency and per-port bandwidth; not measured and not fitted to a switch topology.",
          "date": "2026-10-29",
          "uncertainty_pct": 30
        }
      }
    }
  ],
  "fabric": {
    "links": [
      {
        "id": "node-0-cxl",
        "from": "node-0",
        "to": "remote-pool",
        "latency_ns": 180,
        "bandwidth_bytes_per_ns": 48,
        "in_flight_bytes": 16777216,
        "queue_depth_bytes": 67108864,
        "bidirectional": true,
        "provenance": {
          "kind": "assumed",
          "source": "docs/HARDWARE-MODELS.md CXL per-port preset",
          "method": "One-way latency and sustained bandwidth for a CXL.mem class link; queue depth and in-flight limits are scenario assumptions.",
          "date": "2026-10-29",
          "uncertainty_pct": 30
        }
      }
    ]
  },
  "workload": {
    "type": "synthetic",
    "profile": "kv_cache_decode",
    "model": {
      "name": "llama-3-70b",
      "family": "llama",
      "layers": 80,
      "attention_heads": 64,
      "kv_heads": 8,
      "head_dim": 128,
      "dtype_bytes": 2
    },
    "requests": {
      "arrival_rate_per_second": 2,
      "concurrency": 4,
      "prompt_tokens": 8192,
      "generated_tokens": 128,
      "phase_mix": {
        "prefill": 0.2,
        "decode": 0.8
      }
    }
  },
  "policy": {
    "name": "swap_remote"
  },
  "faults": {
    "node_failures": [],
    "link_degradations": [],
    "packet_loss": {
      "enabled": false,
      "ppm": 0
    }
  },
  "metrics": {
    "percentiles": [
      50,
      95,
      99
    ],
    "sample_interval_ns": 100000000,
    "warmup_ns": 1000000000
  },
  "output": {
    "format": "jsonl",
    "path": "runs/phase1-overflow",
    "include_event_log": false
  }
}
