{"$schema":"../SPECS/config.schema.json","assumptions":["Local DRAM is deliberately tiny (2 GiB) to force capacity pressure; this is a stress scenario, not a model of a real node.","CXL link and pool values are the docs/HARDWARE-MODELS.md presets, not measurements.","Synthetic KV-cache decode with 32-layer GQA geometry; not a captured trace."],"cost_model":{"capacity_per_gib_second":0.0001,"currency":"USD","migration_per_gib":0.001,"transfer_per_gib":0.002},"description":"Small scenario where KV demand exceeds local DRAM, so swap_remote must evict, write back, and fetch over the fabric while local_only must reject. Exercises every Phase 1 code path in a few seconds of wall time.","duration_ns":4000000000,"fabric":{"links":[{"bandwidth_bytes_per_ns":48,"bidirectional":true,"from":"node-0","id":"node-0-cxl","in_flight_bytes":16777216,"latency_ns":180,"provenance":{"date":"2026-10-29","kind":"assumed","method":"One-way latency and sustained bandwidth for a CXL.mem class link.","source":"docs/HARDWARE-MODELS.md CXL per-port preset","uncertainty_pct":30},"queue_depth_bytes":67108864,"to":"remote-pool"}]},"metrics":{"percentiles":[50,95,99],"sample_interval_ns":100000000,"warmup_ns":500000000},"name":"phase1-swap-pressure","nodes":[{"id":"node-0","local_memory":{"bandwidth_bytes_per_ns":400,"capacity_bytes":2147483648,"latency_ns":90,"provenance":{"date":"2026-10-29","kind":"assumed","method":"Preset latency/bandwidth; capacity reduced to force pressure.","source":"docs/HARDWARE-MODELS.md local DRAM preset","uncertainty_pct":25}},"role":"compute"},{"id":"remote-pool","remote_memory":{"bandwidth_bytes_per_ns":48,"capacity_bytes":68719476736,"latency_ns":180,"provenance":{"date":"2026-10-29","kind":"assumed","method":"CXL.mem class latency and per-port bandwidth.","source":"docs/HARDWARE-MODELS.md CXL 2.0/3.0 preset","uncertainty_pct":30}},"role":"memory"}],"output":{"format":"jsonl","include_event_log":true,"path":"runs/phase1-swap-pressure"},"page_size_bytes":2097152,"policy":{"name":"swap_remote"},"seed":7,"version":"0.1","warmup_ns":500000000,"workload":{"model":{"attention_heads":32,"dtype_bytes":2,"head_dim":128,"kv_heads":8,"layers":32,"name":"small-gqa"},"profile":"kv_cache_decode","requests":{"arrival_rate_per_second":20,"concurrency":8,"generated_tokens":64,"prompt_tokens":4096},"type":"synthetic"}}
