{"$schema":"../SPECS/config.schema.json","assumptions":["Hardware values are docs/HARDWARE-MODELS.md presets, not measurements.","The trace is generated by rmemfab, not captured on hardware (label: synthetic).","Replay is open-loop."],"cost_model":{"capacity_per_gib_second":0.0001,"currency":"USD","migration_per_gib":0.001,"transfer_per_gib":0.002},"description":"Replays examples/traces/synthetic-kv-small.jsonl (a synthetic trace; header label says so) on a node with 256 MiB of local DRAM.","duration_ns":1000000000,"fabric":{"links":[{"bandwidth_bytes_per_ns":48,"bidirectional":true,"from":"node-0","id":"node-0-cxl","in_flight_bytes":16777216,"latency_ns":180,"provenance":{"date":"2026-10-29","kind":"assumed","method":"One-way latency and sustained bandwidth for a CXL.mem class link.","source":"docs/HARDWARE-MODELS.md CXL per-port preset","uncertainty_pct":30},"queue_depth_bytes":67108864,"to":"remote-pool"}]},"metrics":{"percentiles":[50,95,99],"sample_interval_ns":150000000,"warmup_ns":0},"name":"phase2-opt125m-measured","nodes":[{"id":"node-0","local_memory":{"bandwidth_bytes_per_ns":400,"capacity_bytes":268435456,"latency_ns":90,"provenance":{"date":"2026-10-29","kind":"assumed","method":"Preset latency/bandwidth; capacity reduced to force pressure.","source":"docs/HARDWARE-MODELS.md local DRAM preset","uncertainty_pct":25}},"role":"compute"},{"id":"remote-pool","remote_memory":{"bandwidth_bytes_per_ns":48,"capacity_bytes":68719476736,"latency_ns":180,"provenance":{"date":"2026-10-29","kind":"assumed","method":"CXL.mem class latency and per-port bandwidth.","source":"docs/HARDWARE-MODELS.md CXL 2.0/3.0 preset","uncertainty_pct":30}},"role":"memory"}],"output":{"format":"jsonl","include_event_log":true,"path":"runs/phase2-trace-replay"},"page_size_bytes":2097152,"policy":{"name":"swap_remote"},"seed":7,"version":"0.1","warmup_ns":0,"workload":{"format":"jsonl","path":"traces/20261029T202303Z-opt-125m/kv_trace.normalized.jsonl","type":"trace"}}
