{"$schema":"../SPECS/config.schema.json","assumptions":["Hardware values are docs/HARDWARE-MODELS.md presets, not measurements.","Workload is synthetic; it is not a captured serving trace.","Operation timing uses requests.tokens_per_second (assumed 50 when omitted); replay is open-loop.","Per-layer weight bytes default to 12 * hidden_size^2 * dtype_bytes."],"cost_model":{"capacity_per_gib_second":0.0001,"currency":"USD","migration_per_gib":0.001,"transfer_per_gib":0.002},"description":"Prefill: per-layer weight reads, activation buffers freed after each layer, and KV written per layer.","duration_ns":2000000000,"fabric":{"links":[{"bandwidth_bytes_per_ns":48,"bidirectional":true,"from":"node-0","id":"node-0-cxl","in_flight_bytes":16777216,"latency_ns":180,"provenance":{"date":"2026-10-29","kind":"assumed","method":"One-way latency and sustained bandwidth for a CXL.mem class link.","source":"docs/HARDWARE-MODELS.md CXL per-port preset","uncertainty_pct":30},"queue_depth_bytes":67108864,"to":"remote-pool"}]},"metrics":{"percentiles":[50,95,99],"sample_interval_ns":100000000,"warmup_ns":0},"name":"phase2-prefill","nodes":[{"id":"node-0","local_memory":{"bandwidth_bytes_per_ns":400,"capacity_bytes":68719476736,"latency_ns":90,"provenance":{"date":"2026-10-29","kind":"assumed","method":"Preset latency/bandwidth; capacity reduced to force pressure.","source":"docs/HARDWARE-MODELS.md local DRAM preset","uncertainty_pct":25}},"role":"compute"},{"id":"remote-pool","remote_memory":{"bandwidth_bytes_per_ns":48,"capacity_bytes":68719476736,"latency_ns":180,"provenance":{"date":"2026-10-29","kind":"assumed","method":"CXL.mem class latency and per-port bandwidth.","source":"docs/HARDWARE-MODELS.md CXL 2.0/3.0 preset","uncertainty_pct":30}},"role":"memory"}],"output":{"format":"jsonl","include_event_log":true,"path":"runs/phase2-prefill"},"page_size_bytes":2097152,"policy":{"name":"swap_remote"},"seed":3,"version":"0.1","warmup_ns":0,"workload":{"model":{"attention_heads":32,"dtype_bytes":2,"head_dim":128,"hidden_size":4096,"kv_heads":8,"layers":8,"name":"toy-gqa"},"profile":"prefill","requests":{"arrival_rate_per_second":5,"concurrency":4,"prefill_tokens_per_second":8000,"prompt_tokens":2048},"type":"synthetic"}}
