{"$schema":"../SPECS/config.schema.json","assumptions":["Local DRAM and CXL values are starting presets from docs/HARDWARE-MODELS.md, not measurements of a specific machine.","Each compute-to-pool link is modeled as an independent byte server; shared pool service contention is not yet modeled in this revision.","The workload is synthetic KV-cache decode derived from Llama-3-70B geometry. It is not a captured serving trace.","Results are relative comparisons between policies until the scenario is calibrated against measured latency distributions."],"description":"Four compute nodes serving Llama-3-70B with a shared CXL-attached memory pool. Compares a hot/cold placement policy against local-only and swap baselines.","duration_ns":60000000000,"fabric":{"links":[{"bandwidth_bytes_per_ns":48,"bidirectional":true,"from":"node-0","id":"node-0-cxl","in_flight_bytes":16777216,"latency_ns":180,"provenance":{"date":"2026-10-28","kind":"assumed","method":"One-way latency and sustained bandwidth for a CXL.mem class link; queue depth and in-flight limits are scenario assumptions.","source":"docs/HARDWARE-MODELS.md CXL per-port preset","uncertainty_pct":30},"queue_depth_bytes":67108864,"to":"remote-pool"},{"bandwidth_bytes_per_ns":48,"bidirectional":true,"from":"node-1","id":"node-1-cxl","in_flight_bytes":16777216,"latency_ns":180,"provenance":{"date":"2026-10-28","kind":"assumed","method":"One-way latency and sustained bandwidth for a CXL.mem class link; queue depth and in-flight limits are scenario assumptions.","source":"docs/HARDWARE-MODELS.md CXL per-port preset","uncertainty_pct":30},"queue_depth_bytes":67108864,"to":"remote-pool"},{"bandwidth_bytes_per_ns":48,"bidirectional":true,"from":"node-2","id":"node-2-cxl","in_flight_bytes":16777216,"latency_ns":180,"provenance":{"date":"2026-10-28","kind":"assumed","method":"One-way latency and sustained bandwidth for a CXL.mem class link; queue depth and in-flight limits are scenario assumptions.","source":"docs/HARDWARE-MODELS.md CXL per-port preset","uncertainty_pct":30},"queue_depth_bytes":67108864,"to":"remote-pool"},{"bandwidth_bytes_per_ns":48,"bidirectional":true,"from":"node-3","id":"node-3-cxl","in_flight_bytes":16777216,"latency_ns":180,"provenance":{"date":"2026-10-28","kind":"assumed","method":"One-way latency and sustained bandwidth for a CXL.mem class link; queue depth and in-flight limits are scenario assumptions.","source":"docs/HARDWARE-MODELS.md CXL per-port preset","uncertainty_pct":30},"queue_depth_bytes":67108864,"to":"remote-pool"}]},"faults":{"link_degradations":[],"node_failures":[],"packet_loss":{"enabled":false,"ppm":0}},"metrics":{"percentiles":[50,95,99],"sample_interval_ns":100000000,"warmup_ns":5000000000},"name":"llama-70b-cxl","nodes":[{"compute":{"accelerator":"H100-80GB","accelerator_memory_bytes":85899345920,"accelerators":8,"provenance":{"date":"2026-10-28","kind":"sourced","method":"Accelerator count and memory capacity from the product class. tokens_per_second intentionally omitted.","source":"NVIDIA H100 SXM product brief"}},"id":"node-0","local_memory":{"bandwidth_bytes_per_ns":400,"capacity_bytes":549755813888,"latency_ns":90,"provenance":{"date":"2026-10-28","kind":"assumed","method":"Socket-class latency and bandwidth chosen for exploration; not measured on the target node.","source":"docs/HARDWARE-MODELS.md local DRAM preset","uncertainty_pct":25}},"role":"compute"},{"compute":{"accelerator":"H100-80GB","accelerator_memory_bytes":85899345920,"accelerators":8,"provenance":{"date":"2026-10-28","kind":"sourced","method":"Accelerator count and memory capacity from the product class. tokens_per_second intentionally omitted.","source":"NVIDIA H100 SXM product brief"}},"id":"node-1","local_memory":{"bandwidth_bytes_per_ns":400,"capacity_bytes":549755813888,"latency_ns":90,"provenance":{"date":"2026-10-28","kind":"assumed","method":"Socket-class latency and bandwidth chosen for exploration; not measured on the target node.","source":"docs/HARDWARE-MODELS.md local DRAM preset","uncertainty_pct":25}},"role":"compute"},{"compute":{"accelerator":"H100-80GB","accelerator_memory_bytes":85899345920,"accelerators":8,"provenance":{"date":"2026-10-28","kind":"sourced","method":"Accelerator count and memory capacity from the product class. tokens_per_second intentionally omitted.","source":"NVIDIA H100 SXM product brief"}},"id":"node-2","local_memory":{"bandwidth_bytes_per_ns":400,"capacity_bytes":549755813888,"latency_ns":90,"provenance":{"date":"2026-10-28","kind":"assumed","method":"Socket-class latency and bandwidth chosen for exploration; not measured on the target node.","source":"docs/HARDWARE-MODELS.md local DRAM preset","uncertainty_pct":25}},"role":"compute"},{"compute":{"accelerator":"H100-80GB","accelerator_memory_bytes":85899345920,"accelerators":8,"provenance":{"date":"2026-10-28","kind":"sourced","method":"Accelerator count and memory capacity from the product class. tokens_per_second intentionally omitted.","source":"NVIDIA H100 SXM product brief"}},"id":"node-3","local_memory":{"bandwidth_bytes_per_ns":400,"capacity_bytes":549755813888,"latency_ns":90,"provenance":{"date":"2026-10-28","kind":"assumed","method":"Socket-class latency and bandwidth chosen for exploration; not measured on the target node.","source":"docs/HARDWARE-MODELS.md local DRAM preset","uncertainty_pct":25}},"role":"compute"},{"id":"remote-pool","remote_memory":{"bandwidth_bytes_per_ns":48,"capacity_bytes":4398046511104,"latency_ns":180,"provenance":{"date":"2026-10-28","kind":"assumed","method":"CXL.mem class latency and per-port bandwidth; not measured and not fitted to a switch topology.","source":"docs/HARDWARE-MODELS.md CXL 2.0/3.0 preset","uncertainty_pct":30}},"role":"memory"}],"output":{"format":"jsonl","include_event_log":true,"path":"runs/llama-70b-cxl"},"page_size_bytes":2097152,"policy":{"name":"hot_cold","params":{"cold_threshold":1,"hot_threshold":8,"max_migrations_per_tick":64,"min_residency_ns":10000000,"tick_ns":1000000}},"seed":42,"version":"0.1","warmup_ns":5000000000,"workload":{"model":{"attention_heads":64,"dtype_bytes":2,"family":"llama","head_dim":128,"kv_heads":8,"layers":80,"name":"llama-3-70b"},"profile":"kv_cache_decode","requests":{"arrival_rate_per_second":8,"concurrency":16,"generated_tokens":512,"phase_mix":{"decode":0.9,"prefill":0.1},"prompt_tokens":4096},"type":"synthetic"}}
