{"$schema":"../SPECS/config.schema.json","assumptions":["Local capacity is intentionally set to 2 GiB to force overflow. A real H100 node has far more DRAM; this scenario exists only to exercise the remote path.","One compute node and one shared pool keep the event stream small enough to inspect by hand.","The workload is synthetic KV-cache decode derived from Llama-3-70B geometry, not a captured trace.","The compute tokens_per_second field is omitted, matching examples/llama-70b-cxl.json. Request duration is therefore driven by modeled memory accesses, not accelerator throughput."],"description":"Minimal overflow scenario: one compute node has a deliberately small local tier, so even a single KV cache exceeds local capacity and must use the shared pool. This verifies the remote path, eviction, and traffic accounting. It is not a hardware recommendation and must not be used for absolute performance claims.","duration_ns":10000000000,"fabric":{"links":[{"bandwidth_bytes_per_ns":48,"bidirectional":true,"from":"node-0","id":"node-0-cxl","in_flight_bytes":16777216,"latency_ns":180,"provenance":{"date":"2026-10-29","kind":"assumed","method":"One-way latency and sustained bandwidth for a CXL.mem class link; queue depth and in-flight limits are scenario assumptions.","source":"docs/HARDWARE-MODELS.md CXL per-port preset","uncertainty_pct":30},"queue_depth_bytes":67108864,"to":"remote-pool"}]},"faults":{"link_degradations":[],"node_failures":[],"packet_loss":{"enabled":false,"ppm":0}},"metrics":{"percentiles":[50,95,99],"sample_interval_ns":100000000,"warmup_ns":1000000000},"name":"phase1-overflow","nodes":[{"compute":{"accelerator":"H100-80GB","accelerator_memory_bytes":85899345920,"accelerators":8,"provenance":{"date":"2026-10-29","kind":"sourced","method":"Accelerator count and memory capacity from the product class. tokens_per_second intentionally omitted.","source":"NVIDIA H100 SXM product brief"}},"id":"node-0","local_memory":{"bandwidth_bytes_per_ns":400,"capacity_bytes":2147483648,"latency_ns":90,"provenance":{"date":"2026-10-29","kind":"assumed","method":"Latency and bandwidth use the local DRAM preset. Capacity is deliberately reduced to 2 GiB so one 8k-context Llama-3-70B KV cache (about 2.54 GiB) cannot fit.","notes":"Test fixture, not a deployment configuration.","source":"docs/HARDWARE-MODELS.md local DRAM preset, capacity overridden for this test"}},"role":"compute"},{"id":"remote-pool","remote_memory":{"bandwidth_bytes_per_ns":48,"capacity_bytes":1099511627776,"latency_ns":180,"provenance":{"date":"2026-10-29","kind":"assumed","method":"CXL.mem class latency and per-port bandwidth; not measured and not fitted to a switch topology.","source":"docs/HARDWARE-MODELS.md CXL 2.0/3.0 preset","uncertainty_pct":30}},"role":"memory"}],"output":{"format":"jsonl","include_event_log":false,"path":"runs/phase1-overflow"},"page_size_bytes":2097152,"policy":{"name":"swap_remote"},"seed":7,"version":"0.1","warmup_ns":1000000000,"workload":{"model":{"attention_heads":64,"dtype_bytes":2,"family":"llama","head_dim":128,"kv_heads":8,"layers":80,"name":"llama-3-70b"},"profile":"kv_cache_decode","requests":{"arrival_rate_per_second":2,"concurrency":4,"generated_tokens":128,"phase_mix":{"decode":0.8,"prefill":0.2},"prompt_tokens":8192},"type":"synthetic"}}
